{
    "e": "kline",
    "E": 1657675754011,
    "s": "BTCUSDT",
    "k": {
        "t": 1657675500000,
        "T": 1657675799999,
        "s": "BTCUSDT",
        "i": "5m",
        "f": 1458722581,
        "L": 1458731181,
        "o": "19411.85000000",
        "c": "19405.05000000",
        "h": "19415.00000000",
        "l": "19378.37000000",
        "v": "297.07434000",
        "n": 8601,
        "x": false,
        "q": "5762128.25577910",
        "V": "138.36981000",
        "Q": "2683904.79370620",
        "B": "0"
    }
}